{
  "agent_code": "NA",
  "period": { "start": "2026-01-05", "end": "2026-01-12" },
  "generated_at": "2026-01-12",
  "coverage_note": "ТЕСТОВЫЕ ДАННЫЕ для проверки скриптов: все материалы вымышлены, ссылки ведут на example.org. Проверены: тестовый источник А, тестовый источник Б.",
  "items": [
    {
      "item_id": "NA-20260112-001",
      "jurisdiction": "US",
      "jurisdiction_name_ru": "США — тестовый штат",
      "issuer_original": "Test Court",
      "issuer_ru": "Тестовый суд",
      "issuer_type": "суд",
      "category": "санкции_за_ошибки_ИИ",
      "doc_type": "судебное_решение",
      "status": "решение_вынесено",
      "date_published": "2026-01-08",
      "date_effective": null,
      "title_original": "Test v. Example, Order on Sanctions",
      "title_ru": "Тест против Примера: определение о санкциях (вымышленное)",
      "identifier": "No. 0:00-cv-00000 (Test Court)",
      "summary_ru": "Вымышленное решение для теста. Суд наложил тестовую санкцию.",
      "key_rule_ru": "Тестовое правило: юрист проверяет ссылки до подачи.",
      "quote_original": null,
      "ru_relevance": "прямой применимости нет",
      "significance": 3,
      "significance_reason": "Тестовая оценка для проверки скрипта.",
      "source_url": "https://example.org/test-order",
      "source_language": "en",
      "secondary_urls": [],
      "verification": "первоисточник",
      "follow_up": null,
      "tags": ["US-XX", "тест"]
    },
    {
      "item_id": "NA-20260112-002",
      "jurisdiction": "CA",
      "jurisdiction_name_ru": "Канада — тестовая провинция",
      "issuer_original": "Test Law Society",
      "issuer_ru": "Тестовое правовое общество",
      "issuer_type": "регулятор_профессии",
      "category": "этика",
      "doc_type": "руководство",
      "status": "принят",
      "date_published": "2026-01-10",
      "date_effective": "2026-03-01",
      "title_original": "Test guidance on generative AI",
      "title_ru": "Тестовое руководство по генеративному ИИ (вымышленное)",
      "identifier": null,
      "summary_ru": "Вымышленное руководство для теста.",
      "key_rule_ru": "Тестовое правило о раскрытии использования ИИ.",
      "quote_original": null,
      "ru_relevance": "Тест: модель для внутренних правил бюро.",
      "significance": 4,
      "significance_reason": "Тестовая оценка для проверки скрипта.",
      "source_url": null,
      "source_language": "fr",
      "secondary_urls": ["https://example.org/news-a", "https://example.org/news-b"],
      "verification": "вторичные_источники",
      "follow_up": "Тест: проверить вступление в силу 2026-03-01.",
      "tags": ["CA-XX", "тест"]
    }
  ]
}
